key,ko,en,fr,it,de,es,ja,pt-BR,ru,zh-Hans
p,루나 누나! 연구실 재료는 제가 금방 모아올게요!,Luna! I'll gather the materials for the laboratory right away!,Luna ! Je vais tout de suite rassembler les matériaux pour le laboratoire !,Luna! Raccoglierò subito i materiali per il laboratorio!,Luna! Ich sammle sofort die Materialien für das Labor!,¡Luna! ¡Reuniré enseguida los materiales para el laboratorio!,ルナ姉ちゃん！研究室の材料なら僕がすぐ集めてきます！,Luna! Vou reunir os materiais para o laboratório agora mesmo!,Луна! Я сейчас же соберу материалы для лаборатории!,露娜姐姐！研究室的材料我马上就去收集！
l,(마을 사람들을 지켜보며) 다들 여전히... 변함이 없네요.,(Watching the villagers) Everyone is still... unchanged.,(En regardant les habitants du village) Ils sont tous encore... inchangés.,(Osservando gli abitanti del villaggio) Sono tutti ancora... immutati.,(Beobachtet die Dorfbewohner) Alle sind immer noch... unverändert.,(Observando a los aldeanos) Todos siguen... sin cambiar.,（村人たちを見つめながら）みんな相変わらず...変わっていませんね。,(Observando os moradores da vila) Todos continuam... iguais.,(Наблюдая за жителями деревни) Все по-прежнему... совсем не изменились.,（望着村民们）大家还是……一点都没变。
l,"마치 시간이 멈춘 것처럼, 어제와 똑같은 얼굴들이에요.","As if time has stopped, they all have the same faces as yesterday.","Comme si le temps s'était arrêté, ils ont tous les mêmes visages qu'hier.","Come se il tempo si fosse fermato, hanno tutti gli stessi volti di ieri.","Als wäre die Zeit stehen geblieben, haben sie alle noch dieselben Gesichter wie gestern.","Como si el tiempo se hubiera detenido, todos tienen las mismas caras de ayer.",まるで時間が止まったみたいに、昨日と同じ顔のままです。,"Como se o tempo tivesse parado, todos têm os mesmos rostos de ontem.","Словно время остановилось, у всех те же лица, что и вчера.","仿佛时间停止了一样, 大家还是和昨天一模一样的表情。"
p,네? 다들 오늘따라 더 기운 넘쳐 보이시는데요?,Huh? Everyone looks even more energetic today though.,"Hein ? Pourtant, tout le monde a l'air encore plus énergique aujourd'hui.",Eh? Però oggi sembrano tutti ancora più pieni di energia.,Hä? Heute wirken doch alle sogar noch energiegeladener.,¿Eh? Pero hoy todos se ven aún más animados.,え？みんな今日はいつもより元気そうに見えますけど？,Hã? Mas hoje todo mundo parece ainda mais animado.,А? Но сегодня все выглядят даже бодрее обычного.,诶？可是今天大家看起来比平时更有精神啊？
l,"피코, 당신 눈에는 그렇게 보이는군요.","Pico, that's how it looks to you.","Pico, c'est ainsi que tu les vois.","Pico, quindi è così che li vedi.","Pico, so sieht es für dich also aus.","Pico, así es como tú lo ves.",ピコ、あなたにはそう見えるんですね。,"Pico, então é assim que você vê as coisas.","Пико, значит, тебе это так видится.","皮科, 在你眼里是这样吗。"
l,연구실이 완성되면 광산의 환경을 당신에게 유리하게 바꿔둘게요.,"Once the laboratory is complete, I'll adjust the mine's environment to benefit you.","Une fois le laboratoire terminé, j'adapterai l'environnement de la mine à ton avantage.","Quando il laboratorio sarà completato, modificherò l'ambiente della miniera a tuo favore.","Sobald das Labor fertig ist, werde ich die Bedingungen der Mine zu deinem Vorteil verändern.","Cuando el laboratorio esté terminado, ajustaré el entorno de la mina para beneficiarte.",研究室が完成したら、鉱山の環境をあなたに有利なように整えておきます。,"Quando o laboratório estiver pronto, ajustarei o ambiente da mina para favorecer você.","Когда лаборатория будет готова, я изменю условия в шахте так, чтобы они были выгодны тебе.","等研究室完成后, 我会把矿山环境调整得更适合你。"
l,"매장량도 늘리고 장애물도 줄여서, 일을 빨리 끝낼 수 있게 말이에요.",I'll increase the amount of ore deposits and reduce obstacles so you can finish your work faster.,J'augmenterai aussi les gisements et réduirai les obstacles pour que tu puisses terminer ton travail plus vite.,"Aumenterò anche i giacimenti e ridurrò gli ostacoli, così potrai finire il lavoro più velocemente.","Ich werde die Erzvorkommen erhöhen und Hindernisse reduzieren, damit du deine Arbeit schneller beenden kannst.",También aumentaré los depósitos minerales y reduciré los obstáculos para que puedas terminar el trabajo más rápido.,鉱石の埋蔵量も増やして、障害物も減らして、もっと早く作業を終えられるようにします。,Também aumentarei os depósitos minerais e reduzirei os obstáculos para que você termine o trabalho mais rápido.,"Я увеличу количество залежей и уменьшу препятствия, чтобы ты мог быстрее закончить работу.","我会增加矿脉储量, 减少障碍物, 让你能更快完成工作。"
p,루나 누나가 도와주시면 촌장님도 저를 더 대견해하실 거예요!,"If you help me, Luna, the chief will be even prouder of me!","Si tu m'aides, Luna, le chef sera encore plus fier de moi !","Se mi aiuti, Luna, il capo sarà ancora più fiero di me!","Wenn du mir hilfst, Luna, wird der Dorfchef noch stolzer auf mich sein!","¡Si me ayudas, Luna, el jefe estará aún más orgulloso de mí!",ルナ姉ちゃんが手伝ってくれたら、村長さんももっと僕を褒めてくれますよ！,"Se você me ajudar, Luna, o chefe ficará ainda mais orgulhoso de mim!","Если ты поможешь мне, Луна, староста будет гордиться мной ещё больше!","如果露娜姐姐愿意帮我, 村长一定会更加为我骄傲的！"
l,"(잠시 망설이다가) ...피코, 가끔은 너무 열심히 일하지 않아도 돼요.","(Hesitates for a moment) ...Pico, sometimes you don't have to work so hard.","(Hésite un instant) ...Pico, tu n'es pas obligé de travailler aussi dur tout le temps.","(Esita per un momento) ...Pico, a volte non è necessario lavorare così duramente.","(Zögert einen Moment) ...Pico, manchmal musst du nicht so hart arbeiten.","(Duda un momento) ...Pico, a veces no necesitas esforzarte tanto.",（少しためらってから）...ピコ、時にはそんなに頑張りすぎなくてもいいんですよ。,"(Hesita por um momento) ...Pico, às vezes você não precisa trabalhar tanto assim.","(На мгновение колеблется) ...Пико, тебе не обязательно всегда так усердно работать.","（犹豫了片刻）……皮科, 有时候其实不用那么拼命工作。"
p,네? 전 일하는 게 하나도 안 힘든걸요!,Huh? Working isn't tiring for me at all!,Hein ? Travailler ne me fatigue pas du tout !,Eh? Per me lavorare non è affatto faticoso!,Hä? Arbeiten ist für mich überhaupt nicht anstrengend!,¿Eh? ¡Trabajar no me cansa para nada!,え？僕、働くの全然つらくないですよ！,Hã? Trabalhar não é cansativo para mim nem um pouco!,А? Да мне совсем не тяжело работать!,诶？我工作一点都不觉得累啊！
l,피로를 느끼지 않는 건... 좋은 것만은 아니니까요. 일단은 다녀오세요.,"Not being able to feel fatigue... isn't necessarily a good thing. For now, go on ahead.","Ne pas ressentir la fatigue... ce n'est pas forcément une bonne chose. Pour l'instant, vas-y.","Non sentire la fatica... non è necessariamente una buona cosa. Per ora, vai pure.",Keine Müdigkeit zu spüren... ist nicht unbedingt etwas Gutes. Geh jetzt erst einmal.,"No sentir fatiga... no siempre es algo bueno. Por ahora, ve con cuidado.",疲れを感じないというのは...必ずしも良いことではありませんから。とりあえず行ってきてください。,"Não sentir cansaço... não é necessariamente uma coisa boa. Por enquanto, vá em frente.",Не чувствовать усталости... не всегда хорошо. А пока иди.,"感觉不到疲劳……未必是件好事。总之, 你先去吧。"
T,**,**,**,**,**,**,**,**,**,**





T,********************************************13. 포라 구조*******************************************
p,포라 아주머니!,Aunt Pora!,Tante Pora !,Zia Pora!,Tante Pora!,¡Tia Pora!,ポラおばさん！,Tia Pora!,Тётя Пора!,芙拉阿姨！
p,다친 데는 없으세요? 제가 구하러 왔어요!,Are you hurt anywhere? I came to rescue you!,Vous n'êtes pas blessée ? Je suis venu vous sauver !,Si è fatta male da qualche parte? Sono venuto a salvarla!,"Sind Sie verletzt? Ich bin gekommen, um Sie zu retten!",¿Está herida? ¡Vine a rescatarla!,怪我はありませんか？助けに来ました！,Você se machucou? Eu vim salvar você!,Вы не ранены? Я пришёл вас спасти!,您没受伤吧？我是来救您的！
f,(피코의 부축을 받아 일어나며) 아... 피코구나. 고맙다...,(Gets up with Pico's support) Ah... Pico. Thank you...,"(Se relève avec l'aide de Pico) Ah... c'est toi, Pico. Merci...","(Si rialza aiutandosi con Pico) Ah... sei tu, Pico. Grazie...",(Steht mit Picos Hilfe auf) Ah... Pico bist du. Danke...,"(Se levanta apoyándose en Pico) Ah... eres tú, Pico. Gracias...",（ピコに支えられて立ち上がりながら）ああ…ピコかい。ありがとう…,"(Levanta-se com a ajuda de Pico) Ah... é você, Pico. Obrigada...","(Поднимается с помощью Пико) А... это ты, Пико. Спасибо...",（在皮科的搀扶下站起身）啊……是皮科啊。谢谢你……
f,마을이 무너질 때 정말 끝인 줄 알았어.,"When the village collapsed, I truly thought it was the end.","Quand le village s'est effondré, j'ai vraiment cru que c'était la fin.","Quando il villaggio è crollato, ho davvero pensato che fosse la fine.","Als das Dorf einstürzte, dachte ich wirklich, es wäre das Ende.","Cuando el pueblo se derrumbó, realmente pensé que era el fin.",村が崩れた時、本当に終わりだと思ったよ。,"Quando a vila desabou, eu realmente achei que fosse o fim.","Когда деревня рухнула, я правда подумала, что это конец.","村子崩塌的时候, 我真的以为一切都结束了。"
p,많이 놀라셨죠? 일단 제 어깨에 기대세요.,You must have been really shocked. Lean on my shoulder for now.,Vous avez dû avoir très peur. Appuyez-vous sur mon épaule pour l'instant.,Deve essersi spaventata molto. Per ora si appoggi alla mia spalla.,Sie müssen sehr erschrocken gewesen sein. Lehnen Sie sich erstmal an meine Schulter.,Debió asustarse mucho. Por ahora apóyese en mi hombro.,すごく驚いたでしょう？とりあえず僕の肩につかまってください。,"Você deve ter se assustado muito. Por enquanto, apoie-se no meu ombro.","Вы, наверное, очень испугались. Пока обопритесь на моё плечо.",您一定吓坏了吧？先靠着我的肩膀吧。
f,(숨을 고르며) 휴... 난 괜찮아.,(Catches her breath) Whew... I'm alright.,(Reprend son souffle) Ouf... je vais bien.,(Riprende fiato) Uff... sto bene.,(Atmet tief durch) Puh... mir geht es gut.,(Recupera el aliento) Uf... estoy bien.,（息を整えながら）ふぅ…私は大丈夫だよ。,(Recupera o fôlego) Ufa... estou bem.,(Переводит дыхание) Фух... со мной всё в порядке.,（调整呼吸）呼……我没事。
f,그보다 넌 다친 데 없니?,"More importantly, are you hurt?","Mais toi, tu n'es pas blessé ?","Piuttosto, tu non ti sei fatto male?","Wichtiger ist, bist du verletzt?","Pero tú, ¿no estás herido?",それより、君は怪我してないかい？,"Mas e você, não se machucou?",Но ты сам не ранен?,"比起那个, 你没受伤吧？"
p,네! 멀쩡해요!,Yep! I'm perfectly fine!,Oui ! Je vais très bien !,Sì! Sto benissimo!,Ja! Mir geht's gut!,¡Sí! ¡Estoy perfectamente bien!,はい！元気です！,Sim! Estou ótimo!,Да! Я в полном порядке!,嗯！我没事！
f,(피코의 얼굴을 살피며) 정말 무모하다니까...,(Looks closely at Pico's face) You really are reckless...,(Observe le visage de Pico) Tu es vraiment imprudent...,(Osserva il volto di Pico) Sei davvero spericolato...,(Betrachtet Picos Gesicht) Du bist wirklich leichtsinnig...,(Mira el rostro de Pico) De verdad eres imprudente...,（ピコの顔を見つめながら）本当に無茶するんだから…,(Observa o rosto de Pico) Você realmente é imprudente...,(Осматривает лицо Пико) Ты правда безрассудный...,（打量着皮科的脸）你真是太乱来了……
f,이런 위험한 곳까지 혼자 들어오고.,Coming alone into such a dangerous place.,Entrer seul dans un endroit aussi dangereux.,Venire da solo in un posto così pericoloso.,Ganz allein an so einen gefährlichen Ort zu kommen.,Entrar solo a un lugar tan peligroso.,こんな危ない場所に一人で来るなんて。,Vir sozinho para um lugar tão perigoso.,И прийти одному в такое опасное место.,一个人跑到这么危险的地方来。
p,아주머니 구하러 온 건데요?,"But I came to rescue you, Auntie.",Mais je suis venu vous sauver.,Ma sono venuto a salvarla.,"Aber ich bin gekommen, um Sie zu retten.",Pero vine a rescatarla.,おばさんを助けに来たんですよ？,Mas eu vim salvar você.,Но я же пришёл вас спасать.,可我是来救您的啊？
f,"(작게 웃으며) 그래, 그래.","(Laughs softly) Alright, alright.","(Rit doucement) Oui, oui.","(Sorride piano) Va bene, va bene.","(Lächelt leicht) Ja, ja.","(Sonríe suavemente) Sí, sí.",（小さく笑いながら）はいはい。,"(Sorri levemente) Tudo bem, tudo bem.","(Тихо смеётся) Ладно, ладно.","（轻轻笑着）好啦, 好啦。"
f,정말 고맙구나.,Thank you so much.,Merci beaucoup.,Ti ringrazio davvero.,Vielen Dank.,Muchas gracias.,本当にありがとう。,Muito obrigada.,Спасибо тебе большое.,真的谢谢你。
p,다들 모일 곳을 마련했으니까 어서 가요.,"I prepared a place where everyone can gather, so let's go.","J'ai préparé un endroit où tout le monde peut se réunir, alors allons-y.","Ho preparato un posto dove tutti possono riunirsi, quindi andiamo.","Ich habe einen Ort vorbereitet, an dem sich alle versammeln können, also lass uns gehen.","Preparé un lugar donde todos pueden reunirse, así que vamos.",みんなが集まれる場所を用意したので、早く行きましょう。,"Preparei um lugar onde todos podem se reunir, então vamos.","Я подготовил место, где все смогут собраться, пойдёмте.","我已经准备好了大家集合的地方, 我们快走吧。"
f,"호호, 그래. 어서 가보자.","Hoho, alright. Let's go.","Ho ho, d'accord. Allons-y.","Oh oh, va bene. Andiamo.","Hoho, gut. Dann lass uns gehen.","Jeje, está bien. Vamos.",ほほ、それじゃあ行こうか。,"Hoho, certo. Vamos logo.","Хо-хо, хорошо. Пойдём.","呵呵, 好啊。我们快走吧。"
T,**,**,**,**,**,**,**,**,**,**

T,********************************************14. 마을에서 포라와의 대화*******************************************
p,"포라 아주머니, 이제 좀 쉬세요. 약국은 제가 금방 다시 지어드릴게요!","Aunt Pora, please get some rest now. I'll rebuild the pharmacy for you in no time!","Tante Pora, reposez-vous maintenant. Je vais reconstruire la pharmacie très vite !","Zia Pora, ora si riposi un po'. Ricostruirò presto la farmacia!","Tante Pora, ruhen Sie sich jetzt aus. Ich baue die Apotheke schnell wieder auf!","Tia Pora, ahora descanse un poco. ¡Reconstruiré la farmacia enseguida!",ポラおばさん、もう休んでください。薬局は僕がすぐ建て直します！,"Tia Pora, descanse agora. Vou reconstruir a farmácia rapidinho!","Тётя Пора, теперь отдохните немного. Я быстро отстрою аптеку заново!","芙拉阿姨, 您现在先休息吧。药店我马上就会重新建好的！"
f,"그래, 우리 피코만 믿으마. 약국이 생기면 바로 물약을 준비해둘게.","Alright, I'll trust only you, Pico. Once the pharmacy is rebuilt, I'll prepare potions right away.","Oui, je vais compter sur toi, Pico. Dès que la pharmacie sera reconstruite, je préparerai des potions.","Va bene, mi affiderò a te, Pico. Appena la farmacia sarà pronta, preparerò subito le pozioni.","Gut, ich vertraue dir, Pico. Sobald die Apotheke steht, bereite ich sofort Tränke vor.","Claro, confiaré en ti, Pico. En cuanto la farmacia esté lista, prepararé pociones.",そうだね、ピコを信じるよ。薬局ができたら、すぐにポーションを用意しておくからね。,"Claro, vou confiar em você, Pico. Assim que a farmácia estiver pronta, prepararei as poções.","Хорошо, я доверюсь тебе, Пико. Как только аптека будет готова, я сразу приготовлю зелья.","好, 我就相信你了, 皮科。等药店建好后, 我马上就会准备药水。"
f,이번에는 나도 네 일을 조금 도와줄게.,"This time, I'll help with your work a little too.","Cette fois, moi aussi je vais t'aider un peu.",Questa volta aiuterò anch'io un po' nel tuo lavoro.,Dieses Mal werde ich dir auch ein wenig helfen.,Esta vez yo también te ayudaré un poco.,今回は私も少し君の仕事を手伝うよ。,Desta vez eu também vou ajudar um pouco no seu trabalho.,В этот раз я тоже немного помогу тебе с работой.,这一次我也会稍微帮帮你的。
f,네가 주문한 물약들은 내가 광산에 미리 묻어둘게.,I'll bury the potions you ordered throughout the mine beforehand.,J'enterrerai à l'avance dans la mine les potions que tu as commandées.,Nasconderò in anticipo nella miniera le pozioni che hai ordinato.,Ich werde die von dir bestellten Tränke vorher in der Mine verstecken.,Enterraré por adelantado las pociones que pediste en la mina.,君が注文したポーションは、私があらかじめ鉱山に埋めておくよ。,Vou esconder previamente na mina as poções que você pediu.,"Я заранее спрячу в шахте зелья, которые ты заказал.","你订购的药水, 我会提前埋在矿山里的。"
p,우와! 그럼 꼭 찾아내야겠네요!,Wow! Then I definitely have to find them!,Waouh ! Alors je vais absolument devoir les trouver !,Wow! Allora dovrò assolutamente trovarle!,Wow! Dann muss ich sie unbedingt finden!,¡Guau! ¡Entonces tendré que encontrarlas sí o sí!,わあ！それなら絶対に見つけなきゃですね！,Uau! Então eu preciso encontrar elas com certeza!,Ого! Тогда мне обязательно нужно их найти!,哇！那我一定得把它们找出来！
p,내구도를 올려주는 물약이랑 파워를 세지게 하는 물약부터 살게요!,I'll buy the potions that increase durability and strength first!,Je vais d'abord acheter les potions qui augmentent l'endurance et la puissance !,Comprerò prima le pozioni che aumentano la resistenza e la forza!,"Ich kaufe zuerst die Tränke, die Haltbarkeit und Kraft erhöhen!",¡Primero compraré las pociones que aumentan la durabilidad y la fuerza!,耐久力を上げるポーションと、パワーを強くするポーションから買います！,Vou comprar primeiro as poções que aumentam durabilidade e força!,"Сначала я куплю зелья, которые повышают прочность и силу!",我会先买提升耐久度和力量的药水！
f,"호호, 그래. 필요한 물약이 있으면 언제든 말하렴.","Hoho, alright. If you need any potions, tell me anytime.","Ho ho, très bien. Si tu as besoin d'une potion, dis-le-moi quand tu veux.","Oh oh, va bene. Se hai bisogno di una pozione, dimmelo pure.","Hoho, gut. Wenn du einen Trank brauchst, sag jederzeit Bescheid.","Jeje, claro. Si necesitas alguna poción, dímelo cuando quieras.",ほほ、そうだね。必要なポーションがあったらいつでも言うんだよ。,"Hoho, claro. Se precisar de alguma poção, é só me falar.","Хо-хо, хорошо. Если понадобится какое-нибудь зелье, говори в любое время.","呵呵, 好啊。需要什么药水的话, 随时告诉我。"
p,제가 주문한 물약들을 찾으면서 파내려가면 광산 일이 훨씬 즐거울 것 같아요!,Digging while searching for the potions I ordered sounds way more fun!,Creuser tout en cherchant les potions que j'ai commandées a l'air beaucoup plus amusant !,Scavare mentre cerco le pozioni che ho ordinato sembra molto più divertente!,Beim Graben nach den bestellten Tränken macht die Arbeit in der Mine bestimmt viel mehr Spaß!,¡Excavar mientras busco las pociones que pedí suena mucho más divertido!,注文したポーションを探しながら掘り進めたら、鉱山の仕事がもっと楽しくなりそうです！,Cavar enquanto procuro as poções que encomendei parece muito mais divertido!,"Копать, одновременно разыскивая заказанные зелья, будет гораздо веселее!","一边挖矿一边寻找我订购的药水, 感觉会有趣多了！"
f,(피코의 팔을 살짝 쓰다듬으며) ...넌 정말 변함이 없구나.,(Gently strokes Pico's arm) ...You really never change.,(Caresse doucement le bras de Pico) ...Tu ne changes vraiment jamais.,(Accarezza leggermente il braccio di Pico) ...Tu non cambi mai davvero.,(Streichelt sanft Picos Arm) ...Du veränderst dich wirklich nie.,(Acaricia suavemente el brazo de Pico) ...Realmente nunca cambias.,（ピコの腕をそっと撫でながら）...本当に変わらない子だね。,(Acaricia suavemente o braço de Pico) ...Você realmente nunca muda.,(Легонько гладит Пико по руке) ...Ты и правда совсем не меняешься.,（轻轻抚摸着皮科的手臂）……你真是一点都没变呢。
p,"헤헤, 촌장님도 제가 마을의 희망이라고 하셨는걸요! 얼른 재료 모아올게요!","Hehe, the chief said I'm the hope of the village too! I'll go gather the materials right away!","Héhé, le chef a aussi dit que j'étais l'espoir du village ! Je vais vite aller chercher les matériaux !","Hehe, anche il capo ha detto che sono la speranza del villaggio! Andrò subito a raccogliere i materiali!","Hehe, der Dorfchef hat auch gesagt, dass ich die Hoffnung des Dorfes bin! Ich hole schnell die Materialien!","Jeje, ¡el jefe también dijo que soy la esperanza del pueblo! ¡Iré a reunir materiales enseguida!",へへ、村長さんも僕が村の希望だって言ってくれました！すぐに材料を集めてきます！,"Hehe, o chefe também disse que eu sou a esperança da vila! Vou buscar os materiais agora mesmo!","Хе-хе, староста тоже сказал, что я — надежда деревни! Я быстро соберу материалы!","嘿嘿, 村长也说我是村子的希望呢！我马上就去收集材料！"
f,조심해서 다녀오렴. 네가 다치지 않는 게 제일 중요하니까.,Be careful out there. The most important thing is that you don't get hurt.,"Fais attention à toi. Le plus important, c'est que tu ne sois pas blessé.",Fai attenzione. La cosa più importante è che tu non ti faccia male.,"Pass gut auf dich auf. Das Wichtigste ist, dass du dich nicht verletzt.",Ten cuidado. Lo más importante es que no salgas herido.,気をつけて行っておいで。君が怪我しないことが一番大事だからね。,Tome cuidado. O mais importante é que você não se machuque.,Будь осторожен. Самое главное — чтобы ты не пострадал.,路上小心。最重要的是你不要受伤。
T,**,**,**,**,**,**,**,**,**,**


T,********************************************15. 톱니 모양의 쇳덩이 발견*******************************************
p,어? 흙 속에 엄청 튼튼해 보이는 쇳덩이가 묻혀 있어. 꼭 커다란 기계의 부속품처럼 생겼는데?,Huh? There's a huge chunk of metal buried in the dirt. It looks just like a part from some giant machine.,Hein ? Il y a un énorme morceau de métal enterré dans la terre. On dirait une pièce d'une gigantesque machine.,Eh? C'è un enorme pezzo di metallo sepolto nella terra. Sembra proprio un componente di una gigantesca macchina.,Huh? Da ist ein riesiger Metallklumpen im Boden vergraben. Sieht aus wie ein Teil einer großen Maschine.,¿Eh? Hay un enorme pedazo de metal enterrado en la tierra. Parece una pieza de una máquina gigantesca.,あれ？土の中にすごく頑丈そうな金属の塊が埋まってる。まるで大きな機械の部品みたいだ。,Hã? Tem um enorme pedaço de metal enterrado na terra. Parece peça de uma máquina gigantesca.,А? В земле закопан какой-то очень прочный кусок металла. Похоже на деталь огромной машины.,"咦？土里埋着一块看起来特别结实的金属块, 简直像是什么巨大机器的零件。"
