key,ko,en,fr,it,de,es,ja,pt-BR,ru,zh-Hans
e,맞아. 지옥 같은 열기를 뚫고 들어가 그놈의 심장에 '진정의 기운'을 전달할 존재가 필요하지.,That's right. We need someone who can push through that hellish heat and deliver a 'calming force' to its heart.,C'est exact. Nous avons besoin de quelqu'un capable de traverser cette chaleur infernale et d'apporter une « force apaisante » à son cœur.,Esatto. Serve qualcuno che riesca a farsi strada attraverso quel calore infernale e portare una 'forza calmante' al suo cuore.,"Genau. Wir brauchen jemanden, der diese höllische Hitze durchdringen und seinem Herzen eine 'beruhigende Kraft' übermitteln kann.",Así es. Necesitamos a alguien capaz de atravesar ese calor infernal y llevar una 'fuerza calmante' hasta su corazón.,そうだ。地獄のような熱気を突き抜け、あいつの心臓に『鎮静の力』を届けられる存在が必要なんだ。,Isso mesmo. Precisamos de alguém capaz de atravessar esse calor infernal e levar uma 'força calmante' ao coração da criatura.,"Верно. Нам нужен тот, кто сможет пройти сквозь адский жар и передать сердцу чудовища 'силу успокоения'.","没错。我们需要一个能穿过地狱般高温, 把“平静之力”传达到那家伙心脏的人。"
e,"피코, 넌 우리 마을에서 가장 특별하게 태어난 아이란다.","Pico, you were born as the most special child in our village.","Pico, tu es l'enfant le plus spécial né dans notre village.","Pico, sei nato come il bambino più speciale del nostro villaggio.","Pico, du bist das außergewöhnlichste Kind, das unser Dorf je hervorgebracht hat.","Pico, naciste como el niño más especial de nuestro pueblo.",ピコ、お前はこの村で最も特別に生まれた子なんだ。,"Pico, você nasceu como a criança mais especial da nossa vila.","Пико, ты родился самым особенным ребёнком нашей деревни.","皮科, 你是我们村子里最特别的孩子。"
e,"네가 '곡괭이'로 놈의 심장을 내리치면, 네 안에 숨겨진 푸른 빛이 뿜어져 나와 놈의 폭주를 멈출 거야.","If you strike its heart with your 'pickaxe', the hidden blue light inside you will burst forth and stop its rampage.","Si tu frappes son cœur avec ta 'pioche', la lumière bleue cachée en toi jaillira et arrêtera sa folie.","Se colpirai il suo cuore con il tuo 'piccone', la luce blu nascosta dentro di te esploderà e fermerà la sua furia.","Wenn du sein Herz mit deiner 'Spitzhacke' triffst, wird das verborgene blaue Licht in dir hervorbrechen und seinen Amoklauf stoppen.","Si golpeas su corazón con tu 'pico', la luz azul oculta dentro de ti estallará y detendrá su desenfreno.",お前が『ツルハシ』であいつの心臓を打てば、お前の中に眠る青い光が溢れ出し、あいつの暴走を止めるだろう。,"Se você atingir o coração da criatura com sua 'picareta', a luz azul escondida dentro de você explodirá e deterá sua fúria.","Если ты ударишь его сердце своей 'киркой', скрытый внутри тебя синий свет вырвется наружу и остановит его безумие.","只要你用“镐子”击中心脏, 你体内隐藏的蓝色光芒就会爆发出来, 阻止它暴走。"
p,곡괭이로 심장을 치면 제 빛이 나온다고요? 제가 정말 마을을 구할 수 있을까요?,"If I strike the heart with my pickaxe, my light will come out? Can I really save the village?","Si je frappe le cœur avec ma pioche, ma lumière apparaîtra ? Est-ce que je peux vraiment sauver le village ?","Se colpisco il cuore con il mio piccone, la mia luce uscirà fuori? Posso davvero salvare il villaggio?","Wenn ich das Herz mit meiner Spitzhacke treffe, kommt mein Licht zum Vorschein? Kann ich das Dorf wirklich retten?","¿Si golpeo el corazón con mi pico, saldrá mi luz? ¿De verdad puedo salvar al pueblo?",ツルハシで心臓を叩けば、僕の光が出るんですか？本当に僕が村を救えるんでしょうか？,"Se eu atingir o coração com minha picareta, minha luz vai surgir? Eu realmente consigo salvar a vila?","Если я ударю сердце киркой, мой свет высвободится? Я правда смогу спасти деревню?","只要用镐子击中心脏, 我的光就会出现吗？我真的能拯救村子吗？"
e,(품속에서 기괴한 무늬가 새겨진 낡은 금속 열쇠를 꺼내 건네며),(Pulls out an old metal key engraved with grotesque patterns from his coat and hands it over.),(Sort de son manteau une vieille clé métallique gravée de motifs grotesques et la tend à Pico.),(Estrae dal cappotto una vecchia chiave di metallo incisa con motivi grotteschi e la porge a Pico.),(Zieht einen alten Metallschlüssel mit grotesken Mustern aus seinem Mantel und reicht ihn Pico.),(Saca de su abrigo una vieja llave metálica grabada con patrones grotescos y se la entrega a Pico.),（不気味な模様が刻まれた古びた金属の鍵を懐から取り出して差し出す。）,(Tira do casaco uma velha chave metálica gravada com padrões grotescos e a entrega a Pico.),(Достаёт из одежды старый металлический ключ с жуткими узорами и протягивает его Пико.),（从怀中取出一把刻着诡异纹路的古老金属钥匙递了过去。）
e,이건 놈이 잠들어 있는 '심연의 문'을 여는 유일한 열쇠란다. 이 뒤에 우리 모두의 평화가 걸려 있어.,This is the only key that opens the 'Abyssal Gate' where that creature sleeps. The peace of all of us lies beyond it.,C'est la seule clé qui ouvre la 'Porte de l'Abîme' où cette créature dort. La paix de nous tous repose derrière elle.,Questa è l'unica chiave che apre la 'Porta dell'Abisso' dove dorme quella creatura. La pace di tutti noi dipende da ciò che c'è oltre.,"Dies ist der einzige Schlüssel, der das 'Tor des Abgrunds' öffnet, hinter dem diese Kreatur schläft. Der Frieden von uns allen hängt davon ab.",Esta es la única llave que abre la 'Puerta del Abismo' donde duerme esa criatura. La paz de todos nosotros depende de ello.,これは、あいつが眠る『深淵の門』を開く唯一の鍵なんだ。この先には、私たち全員の平和がかかっている。,Esta é a única chave que abre o 'Portão do Abismo' onde a criatura dorme. A paz de todos nós depende do que há além dele.,"Это единственный ключ, открывающий 'Врата Бездны', за которыми спит это существо. За ними — мир для всех нас.",这是开启那家伙沉睡之地“深渊之门”的唯一钥匙。我们的和平全都寄托在那之后。
e,오직 너만이 그 열기를 뚫고 들어가 마을을 구할 수 있단다. 넌 우리 마을의 자부심이 될 거야.,Only you can push through that heat and save the village. You will become the pride of our village.,Toi seul peux traverser cette chaleur et sauver le village. Tu deviendras la fierté de notre village.,Solo tu puoi attraversare quel calore e salvare il villaggio. Diventerai l'orgoglio del nostro villaggio.,Nur du kannst diese Hitze durchdringen und das Dorf retten. Du wirst der Stolz unseres Dorfes werden.,Solo tú puedes atravesar ese calor y salvar al pueblo. Te convertirás en el orgullo de nuestro pueblo.,あの熱気を突き抜けて村を救えるのは、お前だけなんだ。お前はこの村の誇りになるだろう。,Só você pode atravessar esse calor e salvar a vila. Você se tornará o orgulho da nossa vila.,Только ты способен пройти сквозь этот жар и спасти деревню. Ты станешь гордостью нашей деревни.,"只有你能穿过那股热浪, 拯救村庄。你会成为我们村子的骄傲。"
p,"제가 마을을 구할 수 있다면... 해볼게요! 촌장님, 믿어주셔서 감사해요.","If I can save the village... then I'll do it! Thank you for believing in me, Chief.","Si je peux sauver le village... alors je le ferai ! Merci de croire en moi, Chef.","Se posso salvare il villaggio... allora lo farò! Grazie per aver creduto in me, capo.","Wenn ich das Dorf retten kann... dann werde ich es tun! Danke, dass Sie an mich glauben, Chef.","Si puedo salvar al pueblo... ¡lo haré! Gracias por creer en mí, jefe.",僕に村が救えるなら...やってみます！村長さん、信じてくれてありがとうございます。,"Se eu posso salvar a vila... então farei isso! Obrigado por acreditar em mim, chefe.","Если я могу спасти деревню... тогда я сделаю это! Спасибо, что верите в меня, староста.","如果我能拯救村子……我会去做的！谢谢您相信我, 村长。"
e,"그래, 가서 놈의 갈증을 풀어주렴. 네가 그곳에 닿는 순간, 이 뜨거운 고통도 모두 사라질 거다.","Yes, go and quench its thirst. The moment you reach that place, this burning suffering will all disappear.","Oui, va étancher sa soif. Dès que tu atteindras cet endroit, cette souffrance brûlante disparaîtra.","Sì, vai a placare la sua sete. Nel momento in cui raggiungerai quel luogo, tutta questa sofferenza ardente scomparirà.","Ja, geh und stille seinen Durst. In dem Moment, in dem du diesen Ort erreichst, wird all dieses brennende Leid verschwinden.","Sí, ve y calma su sed. En el momento en que llegues allí, todo este dolor abrasador desaparecerá.",そうだ、行ってあいつの渇きを満たしてやるんだ。お前がそこへ辿り着いた瞬間、この灼けるような苦しみもすべて消えるだろう。,"Sim, vá e sacie a sede da criatura. No momento em que você chegar lá, todo esse sofrimento ardente desaparecerá.","Да, иди и утоли его жажду. В тот миг, когда ты доберёшься туда, эта жгучая боль исчезнет.","没错, 去平息它的饥渴吧。当你抵达那里的一瞬间, 这炽热的痛苦也会全部消失。"
p,(열쇠를 꽉 쥐고 비장하면서도 기쁜 표정으로 광산 입구를 향해 달려간다.),(Clutches the key tightly and runs toward the mine entrance with a solemn yet joyful expression.),(Serre la clé contre lui et court vers l'entrée de la mine avec une expression à la fois grave et joyeuse.),(Stringe forte la chiave e corre verso l'ingresso della miniera con un'espressione solenne ma felice.),"(Umklammert den Schlüssel fest und rennt mit einem ernsten, aber freudigen Ausdruck zum Mineneingang.)",(Aprieta la llave con fuerza y corre hacia la entrada de la mina con una expresión solemne pero feliz.),（鍵を強く握りしめ、決意と喜びの入り混じった表情で鉱山の入り口へ駆け出していく。）,"(Aperta a chave com força e corre em direção à entrada da mina com uma expressão solene, mas feliz.)","(Крепко сжимает ключ и бежит к входу в шахту с серьёзным, но радостным выражением лица.)","（紧紧握住钥匙, 带着悲壮却欣喜的表情朝矿山入口跑去。）"
e,(멀어지는 피코의 뒷모습을 한참 동안 바라보다가 아주 낮게 읊조린다.),(Watches Pico's fading figure for a long time before murmuring quietly.),(Observe longuement la silhouette de Pico s'éloigner avant de murmurer doucement.),(Osserva a lungo la figura di Pico allontanarsi prima di mormorare sottovoce.),(Beobachtet lange Picos verschwindende Gestalt und murmelt dann leise.),(Observa durante mucho tiempo la figura de Pico alejándose antes de murmurar en voz baja.),（遠ざかっていくピコの背中を長い間見つめた後、静かに呟く。）,(Observa por muito tempo a figura de Pico se afastando antes de murmurar baixinho.),"(Долго смотрит вслед удаляющемуся Пико, затем тихо шепчет.)","（久久注视着皮科远去的背影, 随后低声呢喃。）"
e,부디 길을 잃지 말고 잘 찾아가야 할 텐데...,I only hope you don't lose your way and manage to reach it safely...,J'espère simplement que tu ne te perdras pas et que tu atteindras cet endroit sain et sauf...,Spero solo che tu non perda la strada e riesca ad arrivarci sano e salvo...,"Ich hoffe nur, dass du dich nicht verirrst und sicher dort ankommst...",Solo espero que no te pierdas y logres llegar allí sano y salvo...,どうか道に迷わず、無事に辿り着いてくれればいいが...,Só espero que você não se perca e consiga chegar lá em segurança...,"Надеюсь только, что ты не собьёшься с пути и сумеешь добраться туда...","只希望你不要迷路, 能够顺利抵达那里……"
T,**,**,**,**,**,**,**,**,**,**





T,********************************************29. 제단에서 촌장과의 대면*******************************************
p,촌장님? 여긴 위험하다고 하셨는데 어떻게 먼저 오신 거예요?,"Chief? You said this place was dangerous, so how did you get here before me?","Chef ? Vous aviez dit que cet endroit était dangereux, alors comment êtes-vous arrivé ici avant moi ?","Capo? Avevate detto che questo posto era pericoloso, quindi come avete fatto ad arrivare qui prima di me?","Chef? Ihr habt doch gesagt, dieser Ort sei gefährlich. Wie seid ihr dann vor mir hierher gekommen?","¿Jefe? Dijo que este lugar era peligroso, ¿entonces cómo llegó aquí antes que yo?",村長？ここは危険だって言ってたのに、どうして先に来てるんですか？,Chefe? O senhor disse que este lugar era perigoso. Então como chegou aqui antes de mim?,"Староста? Вы же говорили, что здесь опасно. Тогда как вы оказались здесь раньше меня?",村长？您不是说这里很危险吗？怎么会比我先到这里？
p,어... 그런데 저기 좀 보세요. 보라색 광석 가운데가 꼭 제 모양처럼 파여 있어요.,Uh... But look over there. The middle of that purple ore is carved exactly like my shape.,Euh... Mais regardez là-bas. Le centre de ce minerai violet est creusé exactement à ma forme.,Eh... Ma guardate laggiù. Il centro di quel minerale viola è scavato esattamente con la mia forma.,Äh... Aber schaut mal dort drüben hin. Die Mitte dieses violetten Erzes ist genau in meiner Form ausgehöhlt.,Eh... Pero mire eso. El centro de ese mineral morado tiene exactamente mi forma.,あれ…でも見てください。あの紫色の鉱石の真ん中、僕の形みたいにくぼんでます。,Ah... Mas olhe ali. O meio daquele minério roxo está esculpido exatamente no meu formato.,Эм... Но посмотрите туда. Центр этой фиолетовой руды выдолблен точно по моей форме.,"啊……可是您看那边。那块紫色矿石的中央, 竟然凹出了和我一模一样的形状。"
p,마치 누가 절 기다리고 있었던 것처럼... 왜 제 모양이랑 똑같이 생긴 틀이 있는 거죠?,It's like someone was waiting for me... Why is there a mold shaped exactly like me?,On dirait que quelqu'un m'attendait... Pourquoi y a-t-il un moule exactement à ma forme ?,È come se qualcuno mi stesse aspettando... Perché c'è uno stampo identico alla mia forma?,"Es ist, als hätte jemand auf mich gewartet... Warum gibt es eine Form, die genau wie ich aussieht?",Es como si alguien me hubiera estado esperando... ¿Por qué hay un molde exactamente igual a mí?,まるで誰かが僕を待っていたみたいです…どうして僕と同じ形の型があるんですか？,É como se alguém estivesse me esperando... Por que existe um molde exatamente igual a mim?,"Как будто кто-то ждал меня... Почему здесь есть форма, точно похожая на меня?",简直像是有人一直在等我一样……为什么会有和我一模一样的凹槽？
e,(천천히 돌아보며) 생각보다 일찍 도착했구나.,(Slowly turning around) You arrived earlier than I expected.,(Se retournant lentement) Tu es arrivé plus tôt que je ne le pensais.,(Voltandosi lentamente) Sei arrivato prima del previsto.,"(Dreht sich langsam um) Du bist früher angekommen, als ich erwartet hatte.",(Dándose la vuelta lentamente) Llegaste antes de lo que esperaba.,（ゆっくり振り返りながら）思ったより早く着いたな。,(Virando-se lentamente) Você chegou mais cedo do que eu esperava.,"(Медленно оборачиваясь) Ты добрался раньше, чем я ожидал.",（缓缓转过身）你比我预想中来得更早。
e,"그 열기를 뚫고 여기까지 오다니, 역시 내가 공들여 관리한 보람이 있어.",To make it all the way here through that heat... It proves all the effort I spent maintaining you was worth it.,Traverser cette chaleur pour arriver jusqu'ici... Cela prouve que tous les efforts que j'ai consacrés à te maintenir en état en valaient la peine.,Essere arrivato fin qui attraversando quel calore... dimostra che tutti gli sforzi che ho fatto per mantenerti sono valsi la pena.,"Dass du es trotz dieser Hitze bis hierher geschafft hast... zeigt, dass sich all die Mühe gelohnt hat, die ich in deine Instandhaltung gesteckt habe.",Llegar hasta aquí atravesando ese calor... demuestra que todo el esfuerzo que dediqué a mantenerte valió la pena.,あの熱気を突き抜けてここまで来るとは…やはり私が丹念に整備してきた甲斐があったな。,Chegar até aqui atravessando todo esse calor... prova que todo o esforço que investi em manter você valeu a pena.,"Добраться сюда сквозь этот жар... Значит, все усилия, которые я вложил в твоё обслуживание, были не напрасны.","居然能穿过那样的高热来到这里……看来我一直以来精心维护你, 确实没有白费。"
T,**,**,**,**,**,**,**,**,**,**





T,********************************************30. 피코 속박 후*******************************************
p,촌장님? 이게 무슨... 사슬이 안 풀려요! 제발 이거 좀 놔주세요!,Chief? What is this...?! The chains won't come off! Please let me go!,"Chef ? Qu'est-ce que...?! Les chaînes ne se détachent pas ! S'il vous plaît, laissez-moi partir !","Capo? Che cos'è questo...?! Le catene non si staccano! Vi prego, lasciatemi andare!",Chef? Was ist das...? Die Ketten gehen nicht ab! Bitte lasst mich frei!,"¿Jefe? ¿Qué es esto...? ¡Las cadenas no se sueltan! ¡Por favor, déjeme ir!",村長？これは一体…？！鎖が外れません！お願いです、離してください！,"Chefe? O que é isso...? As correntes não saem! Por favor, me solte!","Староста? Что это...? Цепи не снимаются! Пожалуйста, отпустите меня!",村长？这到底是……？！锁链解不开！求求您放开我！
e,네 모양이 왜 거기 새겨져 있는지 궁금하니? 그건 거기가 바로 네 '자리'이기 때문이란다.,Do you wonder why your shape is carved there? Because that is where you belong.,Tu te demandes pourquoi ta forme est gravée là ? C'est parce que c'est précisément là qu'est ta place.,Ti stai chiedendo perché la tua forma sia incisa lì? Perché quello è esattamente il tuo posto.,"Fragst du dich, warum dort deine Form eingraviert ist? Weil genau dort dein Platz ist.",¿Te preguntas por qué tu forma está grabada ahí? Porque ese es exactamente tu lugar.,なぜそこにお前の形が刻まれているのか気になるか？そこがお前の『居場所』だからだよ。,Está se perguntando por que sua forma está gravada ali? Porque aquele é exatamente o seu lugar.,"Тебе интересно, почему там высечена именно твоя форма? Потому что именно там твоё место.",你很好奇为什么那里会刻着你的形状吗？因为那里本来就是属于你的位置。
e,"피코, 넌 인간이 아니야. 내가 광석을 얻기 위해 공수한 정교한 '냉각 장치'일 뿐이지.","Pico, you are not human. You are merely a sophisticated 'cooling device' I brought here to obtain ore.","Pico, tu n'es pas humain. Tu n'es qu'un sophistiqué « dispositif de refroidissement » que j'ai fait venir pour obtenir du minerai.","Pico, tu non sei umano. Sei soltanto un sofisticato 'dispositivo di raffreddamento' che ho procurato per ottenere minerali.","Pico, du bist kein Mensch. Du bist lediglich eine ausgeklügelte 'Kühlvorrichtung', die ich beschafft habe, um Erz zu gewinnen.","Pico, tú no eres humano. Eres simplemente un sofisticado 'dispositivo de enfriamiento' que traje para obtener minerales.",ピコ、お前は人間じゃない。お前は鉱石を得るために私が用意した精巧な『冷却装置』にすぎない。,"Pico, você não é humano. É apenas um sofisticado 'dispositivo de resfriamento' que trouxe para obter minério.","Пико, ты не человек. Ты всего лишь сложное 'охлаждающее устройство', которое я раздобыл ради добычи руды.","皮科, 你根本不是人类。你不过是我为了获取矿石而运来的精密“冷却装置”罢了。"
p,냉각 장치라니... 무슨 말씀을 하시는 거예요?,A cooling device...? What are you talking about?,Un dispositif de refroidissement...? De quoi parlez-vous ?,Un dispositivo di raffreddamento...? Di cosa state parlando?,Eine Kühlvorrichtung...? Wovon redet ihr da?,¿Un dispositivo de enfriamiento...? ¿De qué está hablando?,冷却装置って…何を言ってるんですか？,Um dispositivo de resfriamento...? Do que o senhor está falando?,Охлаждающее устройство...? О чём вы говорите?,冷却装置……？您到底在说什么？
e,"너는 땅을 파서 광석을 모으는 동시에, 그 과정에서 발생하는 마찰로 냉각 에너지를 축적하게 설계되었단다.",You were designed to dig the earth and gather ore while simultaneously accumulating cooling energy from the friction generated in the process.,Tu as été conçu pour creuser la terre et récolter du minerai tout en accumulant de l'énergie de refroidissement grâce à la friction produite durant ce processus.,"Sei stato progettato per scavare la terra e raccogliere minerali, accumulando allo stesso tempo energia di raffreddamento grazie all'attrito generato durante il processo.","Du wurdest dafür konstruiert, die Erde aufzubrechen und Erz zu sammeln, während du gleichzeitig durch die entstehende Reibung Kühlenergie speicherst.",Fuiste diseñado para cavar la tierra y recolectar minerales mientras acumulas energía de enfriamiento mediante la fricción generada en el proceso.,お前は地面を掘って鉱石を集めると同時に、その過程で生じる摩擦によって冷却エネルギーを蓄積するよう設計されているんだ。,Você foi projetado para cavar a terra e coletar minério enquanto acumula energia de resfriamento através do atrito gerado nesse processo.,"Ты был создан для того, чтобы копать землю и добывать руду, одновременно накапливая охлаждающую энергию за счёт трения, возникающего в процессе.","你被设计成一边挖掘土地, 收集矿石, 一边通过摩擦产生并储存冷却能量。"
e,"부지런히 일할수록 마을엔 광물이 쌓이고, 네 몸속엔 저 괴물을 잠재울 냉각제가 차오르는 일석이조의 구조지.","The harder you worked, the more ore the village gained, and the more coolant accumulated inside your body to suppress that monster. A perfect twofold system.","Plus tu travaillais dur, plus le village accumulait de minerai, et plus ton corps se remplissait de liquide de refroidissement capable d'apaiser ce monstre. Un système parfaitement rentable.","Più lavoravi duramente, più il villaggio accumulava minerali, e più il tuo corpo si riempiva di refrigerante per placare quel mostro. Un sistema perfetto sotto ogni aspetto.","Je fleißiger du gearbeitet hast, desto mehr Erz sammelte das Dorf, und desto mehr Kühlmittel sammelte sich in deinem Körper an, um jenes Monster zu besänftigen. Ein perfektes System mit doppeltem Nutzen.","Cuanto más trabajabas, más minerales obtenía el pueblo, y más refrigerante se acumulaba dentro de tu cuerpo para contener a ese monstruo. Un sistema perfecto de doble beneficio.",お前が働けば働くほど村には鉱石が蓄積され、お前の体にはあの怪物を鎮める冷却剤が満ちていく。一石二鳥の仕組みというわけだ。,"Quanto mais você trabalhava, mais minério a vila acumulava e mais líquido de resfriamento se acumulava em seu corpo para conter aquele monstro. Um sistema perfeito de benefício duplo.","Чем усерднее ты работал, тем больше руды получала деревня, и тем больше охлаждающей жидкости накапливалось в твоём теле, чтобы сдерживать того монстра. Идеальная система двойной выгоды.","你越是勤奋工作, 村子里的矿石就越多, 而你体内积累的冷却剂也会越来越充足, 用来压制那个怪物。这可是“一举两得”的完美结构。"
