key,ko,en,fr,it,de,es,ja,pt-BR,ru,zh-Hans
c,그 친구들이 광석을 부지런히 날라야 그 마을의 '진짜 주인'들이 배부르게 살 수 있거든.,Only when those workers tirelessly carry ore can the 'true masters' of those villages live comfortably.,Ce n'est que lorsque ces travailleurs transportent sans relâche les minerais que les 'véritables maîtres' de ces villages peuvent vivre confortablement.,"Solo quando quei lavoratori trasportano instancabilmente il minerale, i 'veri padroni' di quei villaggi possono vivere comodamente.","Nur wenn diese Arbeiter fleißig Erz heranschaffen, können die 'wahren Herren' dieser Dörfer bequem leben.",Solo cuando esos trabajadores transportan minerales sin descanso pueden vivir cómodamente los 'verdaderos dueños' de esos pueblos.,あいつらがせっせと鉱石を運ぶからこそ、その村の『本当の主人』たちは腹いっぱいで暮らせるのさ。,Só quando esses trabalhadores carregam minério sem parar é que os 'verdadeiros donos' dessas vilas conseguem viver confortavelmente.,"Только когда эти рабочие усердно таскают руду, 'настоящие хозяева' деревень могут жить в сытости.","只有那些家伙拼命搬运矿石, 那些村子的‘真正主人’才能过上富足的生活。"
p,마을의 진짜 주인이요? 그게 누구예요?,The true masters of the village? Who are they?,Les véritables maîtres du village ? Qui sont-ils ?,I veri padroni del villaggio? Chi sarebbero?,Die wahren Herren des Dorfes? Wer soll das sein?,¿Los verdaderos dueños del pueblo? ¿Quiénes son?,村の本当の主人？それって誰のこと？,Os verdadeiros donos da vila? Quem são eles?,Настоящие хозяева деревни? И кто это?,村子的真正主人？那是谁啊？
c,(의미심장하게 웃으며 피코의 어깨를 툭 친다) 글쎄다. 그건 나중에 네가 마을 밖으로 나갈 수 있게 되면 직접 확인해 보렴.,(Smiling meaningfully as he pats Pico on the shoulder) Who knows. You can find out for yourself once you're able to leave the village someday.,(Souriant d'un air mystérieux en tapotant l'épaule de Pico) Qui sait. Tu le découvriras toi-même lorsque tu pourras quitter le village un jour.,(Sorridendo in modo enigmatico mentre dà una pacca sulla spalla di Pico) Chissà. Lo scoprirai da solo quando un giorno potrai lasciare il villaggio.,"(Lächelt bedeutungsvoll und klopft Pico auf die Schulter) Wer weiß. Das wirst du selbst herausfinden, sobald du eines Tages das Dorf verlassen kannst.",(Sonriendo de forma enigmática mientras le da una palmada en el hombro a Pico) Quién sabe. Lo descubrirás tú mismo cuando algún día puedas salir del pueblo.,（意味ありげに笑いながらピコの肩を軽く叩く）さあな。いつか村の外へ出られるようになったら、自分の目で確かめてみるといい。,(Sorrindo de forma enigmática enquanto dá um tapinha no ombro de Pico) Quem sabe. Descubra você mesmo quando puder sair da vila algum dia.,"(С загадочной улыбкой хлопает Пико по плечу) Кто знает. Сам увидишь, когда однажды сможешь покинуть деревню.","（意味深长地笑着拍了拍皮科的肩膀）谁知道呢。等你哪天能离开村子的时候, 就亲自去看看吧。"
c,"다만 한 가지만 기억해라. 이 팔의 주인은 너보다 조금 더 '효율적'이었겠지만, 결국 흙먼지 속에 남겨졌다는 걸 말이야.","Just remember one thing. The owner of this arm may have been a little more 'efficient' than you, but in the end, he was abandoned in the dirt all the same.","Souviens-toi simplement d'une chose. Le propriétaire de ce bras était peut-être un peu plus 'efficace' que toi, mais il a fini abandonné dans la poussière malgré tout.","Ricorda solo una cosa. Il proprietario di questo braccio poteva essere un po' più 'efficiente' di te, ma alla fine è stato comunque abbandonato nella polvere.","Merk dir nur eins. Der Besitzer dieses Arms war vielleicht etwas 'effizienter' als du, doch am Ende wurde auch er im Dreck zurückgelassen.","Solo recuerda una cosa. El dueño de este brazo quizá era un poco más 'eficiente' que tú, pero al final también fue abandonado en el polvo.",ただ一つだけ覚えておけ。この腕の持ち主は、お前より少し『効率的』だったかもしれないが、結局は土埃の中に捨てられたんだ。,"Só se lembre de uma coisa. O dono deste braço talvez fosse um pouco mais 'eficiente' do que você, mas no fim acabou abandonado na poeira do mesmo jeito.","Запомни только одно. Хозяин этой руки, возможно, был чуть более 'эффективным', чем ты, но в итоге его всё равно бросили в пыли.","不过你只要记住一件事。这个手臂的主人也许比你更加‘高效’, 但最后还是被丢弃在尘土里了。"
p,"네? 무슨 말씀인지 잘 모르겠어요, 아저씨!","Huh? I don't really understand what you mean, mister!","Hein ? Je ne comprends pas vraiment ce que vous voulez dire, monsieur !","Eh? Non capisco bene cosa voglia dire, signore!","Hä? Ich verstehe nicht ganz, was Sie meinen, Mister!","¿Eh? ¡No entiendo muy bien lo que quiere decir, señor!",え？おじさんの言ってること、よくわからないよ！,Hã? Não entendi muito bem o que o senhor quis dizer!,"А? Я не совсем понимаю, о чём вы говорите, mister!","诶？大叔, 我完全听不懂您在说什么！"
c,"하하, 몰라도 된다. 자, 이 위험한 고철은 내가 가져가마. 넌 어서 촌장 영감님한테 가서 보석이나 보여드리렴.","Haha, you don't need to understand. Now then, I'll take this dangerous scrap metal. You should hurry off and show some gems to the old chief.","Ha ha, tu n'as pas besoin de comprendre. Bon, je vais prendre cette dangereuse ferraille. Toi, va donc montrer quelques pierres précieuses au vieux chef.","Ahah, non serve che tu capisca. Bene, prenderò io questo pericoloso rottame. Tu vai pure a mostrare qualche gemma al vecchio capo.","Haha, das musst du nicht verstehen. Ich nehme diesen gefährlichen Schrott mit. Geh du lieber dem alten Dorfchef ein paar Edelsteine zeigen.","Jaja, no necesitas entenderlo. Bien, yo me quedaré con esta peligrosa chatarra. Tú ve a mostrarle unas gemas al viejo jefe.",はは、わからなくてもいいさ。さて、この危ないガラクタは俺が持っていこう。お前は早く村長のじいさんに宝石でも見せてやれ。,"Haha, você não precisa entender. Agora, vou levar esta sucata perigosa. Vá logo mostrar algumas joias para o velho chefe.","Ха-ха, тебе и не нужно понимать. Ладно, этот опасный металлолом я заберу. А ты иди скорее покажи старику-старосте свои драгоценности.","哈哈, 你不懂也没关系。好了, 这种危险废铁就由我收走吧。你还是赶紧去给村长老爷子看看宝石吧。"
c,(멀어지는 피코를 보며 낮게 읊조린다) ...이번 모델은 감정이 너무 풍부해서 탈이군.,"(Watching Pico walk away, he mutters quietly) ...This model has far too many emotions.","(Regardant Pico s'éloigner, il marmonne doucement) ...Ce modèle a beaucoup trop d'émotions.","(Guardando Pico allontanarsi, mormora a bassa voce) ...Questo modello ha troppe emozioni.",(Sieht Pico beim Weggehen nach und murmelt leise) ...Dieses Modell hat viel zu viele Emotionen.,"(Mirando a Pico alejarse, murmura en voz baja) ...Este modelo tiene demasiadas emociones.",（去っていくピコを見ながら低く呟く）...今回のモデルは感情が豊かすぎるな。,"(Observando Pico se afastar, murmura baixinho) ...Este modelo tem emoções demais.","(Глядя вслед уходящему Пико, тихо бормочет) ...У этой модели слишком много эмоций.",（望着远去的皮科低声喃喃道）……这次的型号感情也太丰富了。
c,저 녀석도 언제쯤 저 팔처럼 버려질지.,I wonder when that kid will be discarded just like that arm.,Je me demande quand ce gamin sera abandonné comme ce bras.,Chissà quando anche quel ragazzino verrà scartato come quel braccio.,"Ich frage mich, wann dieser Junge wohl genauso weggeworfen wird wie dieser Arm.",Me pregunto cuándo ese chico será desechado igual que ese brazo.,あいつもいつか、あの腕みたいに捨てられるんだろうな。,Será que aquele garoto também será descartado como aquele braço algum dia?,"Интересно, когда и этого мальчишку выбросят так же, как ту руку.",不知道那家伙什么时候也会像这只手臂一样被丢弃。
T,**,**,**,**,**,**,**,**,**,**






T,********************************************23. 비늘 발견*******************************************
p,어? 바위 틈에 웬 보라색 보석이 박혀 있네?,Huh? Why is there a purple gem stuck in this crack in the rock?,Hein ? Pourquoi y a-t-il une gemme violette coincée dans cette fissure du rocher ?,Eh? Perché c'è una gemma viola incastrata nella fessura della roccia?,Huh? Warum steckt in diesem Felsspalt ein violetter Edelstein?,¿Eh? ¿Por qué hay una gema morada incrustada en la grieta de esta roca?,あれ？岩の隙間に紫色の宝石が埋まってる？,Huh? Por que tem uma joia roxa presa na fenda da rocha?,Хм? Почему в трещине скалы застрял фиолетовый драгоценный камень?,咦？岩石缝里怎么嵌着一块紫色宝石？
p,근데 보석치고는 표면이 가죽처럼 거칠거칠하네.,"But for a gem, its surface feels rough like leather.","Mais pour une gemme, sa surface est rugueuse comme du cuir.","Ma per essere una gemma, la superficie è ruvida come pelle.",Aber für einen Edelstein fühlt sich die Oberfläche rau wie Leder an.,"Pero para ser una gema, su superficie se siente áspera como cuero.",でも宝石にしては、表面が革みたいにざらざらしてる。,"Mas para uma joia, a superfície parece áspera como couro.","Но для драгоценного камня поверхность слишком шершавая, словно кожа.","不过作为宝石, 它的表面却像皮革一样粗糙。"
p,"(양손으로 조심스럽게 들어 올리며) 우와, 꽤 묵직하다...","(Carefully lifting it with both hands) Whoa, this is pretty heavy...","(Le soulevant délicatement à deux mains) Waouh, c'est plutôt lourd...","(Sollevandolo con cautela con entrambe le mani) Wow, è piuttosto pesante...","(Hebt es vorsichtig mit beiden Händen hoch) Wow, das ist ziemlich schwer...","(Levantándolo cuidadosamente con ambas manos) Vaya, pesa bastante...",（両手で慎重に持ち上げながら）わあ、結構重たいな...,"(Erguendo com cuidado usando as duas mãos) Uau, isso é bem pesado...","(Осторожно поднимая обеими руками) Ого, довольно тяжёлый...","（小心地用双手捧起来）哇, 好沉啊……"
p,게다가 기분 나쁜 박동 같은 게 느껴지는 것 같은데?,And it even feels like there's some kind of creepy pulse coming from it.,"Et en plus, on dirait qu'il y a une sorte de pulsation inquiétante qui vient de l'intérieur.",E inoltre sembra quasi che emetta una pulsazione inquietante.,"Außerdem fühlt es sich an, als käme ein unheimlicher Puls daraus.","Además, se siente como si tuviera una especie de latido inquietante.",しかも、なんだか気味の悪い鼓動みたいなのを感じるような...？,E ainda parece que tem uma pulsação estranha vindo dele.,"И вдобавок кажется, будто от него исходит какой-то жуткий пульс.",而且感觉里面好像还传来令人不舒服的脉动……
p,이게 돌이 맞나? 꼭 거대한 짐승의 비늘처럼 생겼어.,Is this really a rock? It looks more like the scale of some giant beast.,C'est vraiment une pierre ? On dirait plutôt l'écaille d'une énorme créature.,È davvero una pietra? Sembra più la scaglia di una bestia gigantesca.,Ist das wirklich ein Stein? Es sieht eher aus wie die Schuppe eines riesigen Monsters.,¿Esto de verdad es una piedra? Parece más bien la escama de una bestia gigante.,これ、本当に石なのかな？まるで巨大な獣のウロコみたいだ。,Isso é mesmo uma pedra? Parece mais a escama de uma criatura gigante.,Это точно камень? Больше похоже на чешую какого-то огромного зверя.,这真的是石头吗？看起来简直像某种巨大野兽的鳞片。
p,일단 루나 누나한테 가져가서 보여드려야겠다.,I should take it to Luna and show it to her first.,Je devrais d'abord l'apporter à Luna pour lui montrer.,Prima dovrei portarlo da Luna e mostrarglielo.,Ich sollte es zuerst Luna zeigen.,Debería llevárselo primero a Luna para enseñárselo.,とりあえずルナ姉ちゃんのところに持っていって見せてみよう。,Vou levar isso para a Luna ver primeiro.,Надо сначала отнести это Луне и показать ей.,还是先拿去给露娜姐姐看看吧。
T,**,**,**,**,**,**,**,**,**,**





T,********************************************24. 루나에게 비늘 전달*******************************************
p,"루나 누나! 이것 좀 보세요. 깊은 곳 바닥에서 주웠는데,",Luna! Look at this. I found it deep down in the mine.,Luna ! Regardez ça. Je l'ai trouvé tout au fond de la mine.,Luna! Guarda qui. L'ho trovato nelle profondità della miniera.,Luna! Schau dir das mal an. Ich habe es tief unten in der Mine gefunden.,¡Luna! Mira esto. Lo encontré en lo más profundo de la mina.,ルナ姉ちゃん！これ見てください。鉱山の深いところで拾ったんです。,Luna! Olha isso. Eu encontrei bem no fundo da mina.,Луна! Посмотри на это. Я нашёл это глубоко в шахте.,露娜姐姐！快看这个。我是在矿山深处捡到的。
p,돌이 막 살아있는 것처럼 뜨겁고 꿈틀거려요!,It's hot and squirming like it's alive!,Cette pierre est brûlante et remue comme si elle était vivante !,Questa pietra è calda e si contorce come se fosse viva!,"Der Stein ist heiß und bewegt sich, als wäre er lebendig!",¡La piedra está caliente y se retuerce como si estuviera viva!,石なのに、生きてるみたいに熱くてうごめいてるんです！,A pedra está quente e se mexendo como se estivesse viva!,"Этот камень горячий и извивается, будто живой!","这块石头热得像活着一样, 还在蠕动！"
l,(비늘을 보자마자 숨을 들이키며 뒤로 물러난다.),"(The moment she sees the scale, she gasps and steps back.)","(Dès qu'elle voit l'écaille, elle retient son souffle et recule.)","(Appena vede la scaglia, trattiene il respiro e fa un passo indietro.)","(Als sie die Schuppe sieht, schnappt sie nach Luft und tritt zurück.)","(En cuanto ve la escama, contiene el aliento y retrocede.)",（そのウロコを見た瞬間、息を呑んで後ずさる。）,"(Assim que vê a escama, prende a respiração e recua.)","(Увидев чешую, она резко втягивает воздух и отступает назад.)","（看到鳞片的瞬间, 她倒吸一口气后退了一步。）"
l,"(집게로 조각을 받아 내려놓자, 주변 시약들이 보랏빛으로 반응하며 부글부글 끓어오른다.)","(As she takes the fragment with tongs and sets it down, the nearby reagents react and begin bubbling purple.)","(Lorsqu'elle saisit le fragment avec des pinces et le pose, les réactifs alentour deviennent violets et se mettent à bouillonner.)","(Quando prende il frammento con le pinze e lo posa, i reagenti vicini reagiscono diventando viola e ribollendo.)","(Als sie das Fragment mit einer Zange annimmt und ablegt, reagieren die Reagenzien in der Nähe violett und beginnen zu blubbern.)","(Cuando toma el fragmento con unas pinzas y lo deja, los reactivos cercanos se vuelven morados y comienzan a hervir.)",（ピンセットで欠片を受け取って置くと、周囲の試薬が紫色に反応してぶくぶくと沸き始める。）,"(Quando ela pega o fragmento com uma pinça e o coloca sobre a mesa, os reagentes próximos começam a borbulhar em roxo.)","(Когда она берёт осколок щипцами и кладёт его, окружающие реагенты начинают пузыриться фиолетовым светом.)","（她用夹子接过碎片放下后, 周围的试剂立刻泛起紫光并咕嘟咕嘟沸腾起来。）"
l,"피코, 이걸 손으로 직접 들고 온 건가요?","Pico, did you carry this here with your bare hands?","Pico, tu as porté ça à mains nues ?","Pico, hai portato qui questa cosa a mani nude?","Pico, hast du das mit bloßen Händen hierher getragen?","Pico, ¿trajiste esto con tus propias manos?",ピコ、これを素手で持ってきたんですか？,"Pico, você trouxe isso com as próprias mãos?","Пико, ты нёс это голыми руками?","皮科, 你是直接用手把这个拿过来的吗？"
l,이건 일반적인 광석이 아니에요. 어떤 '생명체'의 일부가 떨어져 나온 겁니다.,This isn't an ordinary ore. It's a fragment that fell from some kind of living creature.,Ce n'est pas un minerai ordinaire. C'est un fragment tombé d'une sorte de créature vivante.,Questo non è un minerale normale. È un frammento caduto da qualche forma di vita.,Das ist kein gewöhnliches Erz. Es ist ein Teilstück eines Lebewesens.,Esto no es un mineral común. Es un fragmento desprendido de algún ser vivo.,これは普通の鉱石じゃありません。何かの『生き物』から剥がれ落ちた一部です。,Isso não é um minério comum. É um fragmento que caiu de algum tipo de criatura viva.,Это не обычная руда. Это часть какого-то живого существа.,"这不是普通矿石, 而是某种“生物”身上掉落的一部分。"
l,아주 오랫동안 지하의 독기를 머금은 채로 말이죠.,And it's been absorbing the underground corruption for a very long time.,Et cela a absorbé les miasmes souterrains pendant très longtemps.,E ha assorbito il miasma sotterraneo per moltissimo tempo.,Und es hat sehr lange die giftige Energie des Untergrunds aufgenommen.,Y ha absorbido la corrupción subterránea durante muchísimo tiempo.,長い間、地下の瘴気を溜め込み続けていたんです。,E ficou absorvendo a corrupção subterrânea por muito tempo.,И оно очень долго впитывало подземную скверну.,而且它已经在地下吸收毒瘴很多很多年了。
p,생명체의 일부요? 하지만 아주 단단한걸요? 꼭 금속 같아요!,Part of a living creature? But it's really hard. It feels like metal!,Une partie d'un être vivant ? Pourtant c'est très dur. On dirait du métal !,Parte di una creatura vivente? Ma è durissimo. Sembra metallo!,Ein Teil eines Lebewesens? Aber es ist unglaublich hart. Fast wie Metall!,¿Parte de un ser vivo? ¡Pero es muy duro! ¡Parece metal!,生き物の一部ですか？でもすごく硬いですよ？まるで金属みたいです！,Parte de uma criatura viva? Mas é muito duro. Parece metal!,Часть живого существа? Но оно такое твёрдое. Почти как металл!,"生物的一部分？可是它特别坚硬, 简直像金属一样！"
l,(떨리는 손으로 비늘에 박힌 결정을 가리키며),(Pointing at the crystal embedded in the scale with trembling hands),"(D'une main tremblante, elle désigne le cristal incrusté dans l'écaille.)",(Indicando con mano tremante il cristallo incastonato nella scaglia),(Zeigt mit zitternder Hand auf den Kristall in der Schuppe.),(Señalando con mano temblorosa el cristal incrustado en la escama),（震える手でウロコに埋まった結晶を指差す。）,(Apontando com as mãos trêmulas para o cristal incrustado na escama),(Дрожащей рукой указывает на кристалл в чешуе.),（她用颤抖的手指向嵌在鳞片中的结晶。）
l,연금술 고서에서는 이런 결정을 '심연의 찌꺼기'라고 불러요.,"In ancient alchemy texts, crystals like this are called 'Residue of the Abyss.'","Dans les anciens grimoires d'alchimie, ce genre de cristal est appelé 'Résidu de l'Abîme'.","Negli antichi testi alchemici, cristalli come questo vengono chiamati 'Residuo dell'Abisso'.",In alten alchemistischen Schriften nennt man solche Kristalle 'Überreste des Abgrunds'.,"En antiguos textos de alquimia, cristales como este son llamados 'Residuos del Abismo'.",錬金術の古文書では、こういう結晶を『深淵の残滓』と呼ぶんです。,"Nos antigos textos de alquimia, cristais assim são chamados de 'Resíduo do Abismo'.",В древних алхимических книгах такие кристаллы называют 'Остатками Бездны'.,炼金术古书中把这种结晶称作“深渊残渣”。
l,무언가 거대한 것이 숨을 내뱉을 때마다 그 열기가 굳어서 만들어지는 결정이죠.,They're crystals formed when the heat from some enormous being's breath solidifies.,Ce sont des cristaux créés lorsque la chaleur du souffle d'une immense créature se solidifie.,Sono cristalli formati dal calore del respiro di una creatura gigantesca che si solidifica.,"Diese Kristalle entstehen, wenn die Hitze des Atems eines gewaltigen Wesens erstarrt.",Son cristales formados cuando el calor del aliento de una criatura gigantesca se solidifica.,何か巨大な存在が吐き出す熱が固まってできた結晶なんです。,São cristais formados quando o calor da respiração de uma criatura gigantesca se solidifica.,"Это кристаллы, образующиеся, когда жар дыхания огромного существа застывает.",它是某种巨大存在呼出的热息凝固后形成的结晶。
l,최근 들어 광산의 진동이 이상할 정도로 규칙적이에요.,"Recently, the tremors in the mine have become unnaturally rhythmic.","Ces derniers temps, les secousses de la mine sont devenues étrangement régulières.",Ultimamente le vibrazioni della miniera sono diventate stranamente regolari.,In letzter Zeit sind die Erschütterungen der Mine unnatürlich regelmäßig geworden.,"Últimamente, los temblores de la mina se han vuelto extrañamente regulares.",最近、鉱山の揺れ方が異様なほど規則的なんです。,"Ultimamente, os tremores da mina ficaram estranhamente regulares.",В последнее время толчки в шахте стали пугающе ритмичными.,最近矿山的震动规律得异常反常。
l,촌장님은 지맥이 불안정할 뿐이라고 하시지만...,"The chief says it's just unstable ley lines, but...","Le chef dit que ce ne sont que des lignes telluriques instables, mais...","Il capo dice che sono solo vene terrestri instabili, ma...","Der Dorfchef sagt, es seien nur instabile Erdadern, aber...","El jefe dice que solo son corrientes subterráneas inestables, pero...",村長さんは地脈が不安定なだけだと言っていますが…。,"O chefe diz que são apenas correntes subterrâneas instáveis, mas...","Староста говорит, что это просто нестабильные подземные жилы, но...","村长说只是地脉不稳定而已, 可是……"
l,제 생각엔 무언가 '거대한 심장'이 다시 뛰기 시작한 것 같아요.,I think some kind of 'massive heart' has started beating again.,Je pense qu'une sorte d'énorme cœur a recommencé à battre.,"Secondo me, una sorta di 'cuore gigantesco' ha ripreso a battere.","Ich glaube, irgendein 'gewaltiges Herz' hat wieder zu schlagen begonnen.",Creo que una especie de 'corazón gigantesco' ha comenzado a latir otra vez.,私には、何か『巨大な心臓』が再び動き始めたように思えるんです。,Eu acho que algum tipo de 'coração gigantesco' começou a bater novamente.,"Мне кажется, что какое-то 'огромное сердце' снова начало биться.","我觉得, 有某种“巨大的心脏”重新开始跳动了。"
p,심장이요? 그럼 진짜로 땅 밑에 누가 살고 있다는 거예요?,A heart? Then does that mean something is really living beneath the ground?,Un cœur ? Alors ça veut dire que quelque chose vit vraiment sous terre ?,Un cuore? Vuol dire che davvero qualcosa vive sotto terra?,"Ein Herz? Bedeutet das, dass wirklich etwas unter der Erde lebt?",¿Un corazón? ¿Entonces de verdad hay algo viviendo bajo tierra?,心臓ですか？じゃあ、本当に地面の下に何かいるってことですか？,Um coração? Então existe mesmo algo vivendo debaixo da terra?,"Сердце? Значит, под землёй действительно кто-то живёт?",心脏？那岂不是说地下真的有什么东西活着吗？
